{
  "kind": "assessment",
  "schema_version": "1.0.0",
  "id": "ASSESS-HARBORAPI",
  "record_status": "EXAMPLE",
  "assignment_id": "A-HARBORAPI",
  "assignment_digest": "sha256:9b50cb2dde7c3bd424713b3a88c9c90de84ca6996dda5aca1a849069e647b2f6",
  "epoch_id": "E-HARBORAPI",
  "subject_digest": "sha256:887e3f510204be19688947b91fc3df3251a2f6ae95e2290705123bd932e5eb04",
  "catalog_digest": "sha256:1d6e8a8f14423a541573c0c95b4921979b6da8ba01596a8268b93f6650002e58",
  "as_of": "2026-09-11T23:19:57.136661+00:00",
  "result_ids": [
    "R-I-01",
    "R-I-02",
    "R-I-03",
    "R-I-04",
    "R-I-05",
    "R-I-06",
    "R-I-07",
    "R-I-08",
    "R-I-09",
    "R-I-10",
    "R-I-11",
    "R-I-12",
    "R-I-13",
    "R-I-14"
  ],
  "evidence_ids": [
    "EV-SCENARIO"
  ],
  "qualification_ids": [],
  "coverage_limitations": [
    "All product states are fictional premises. No product observations, benchmark runs, UI captures, or beneficiary evidence collected.",
    "Illustrative pass/fail states are PROPOSED; no qualification records exist. Operational acceptance remains blocked.",
    "The selected rows are a teaching slice, not comprehensive coverage of the candidate catalog."
  ],
  "registration_state": "PENDING"
}
