{
  "kind": "assessment",
  "schema_version": "1.0.0",
  "id": "ASSESS-DRAFTBOARD",
  "record_status": "EXAMPLE",
  "assignment_id": "A-DRAFTBOARD",
  "assignment_digest": "sha256:7caf8e4d01b2df094d8d8027f2cb2ff474fd8b39bd1fddc54d1b90117e2be75c",
  "epoch_id": "E-DRAFTBOARD",
  "subject_digest": "sha256:447538844e4c631f9a76881e9a0c2ff6ffcae6fe874e185e76cfea8aa52c9c7e",
  "catalog_digest": "sha256:1d6e8a8f14423a541573c0c95b4921979b6da8ba01596a8268b93f6650002e58",
  "as_of": "2026-09-11T23:19:57.136661+00:00",
  "result_ids": [
    "R-I-01",
    "R-I-02",
    "R-I-03",
    "R-I-04",
    "R-I-05",
    "R-I-06",
    "R-I-07",
    "R-I-08",
    "R-I-09",
    "R-I-10",
    "R-I-11",
    "R-I-12",
    "R-I-13",
    "R-I-14",
    "R-I-15",
    "R-I-16",
    "R-I-17",
    "R-I-18",
    "R-I-19",
    "R-I-20",
    "R-I-21",
    "R-I-22",
    "R-I-23",
    "R-I-24",
    "R-I-25",
    "R-I-26",
    "R-I-27",
    "R-I-28",
    "R-I-29",
    "R-I-30",
    "R-I-31",
    "R-I-32",
    "R-I-33",
    "R-I-34",
    "R-I-35",
    "R-I-36"
  ],
  "evidence_ids": [
    "EV-SCENARIO"
  ],
  "qualification_ids": [],
  "coverage_limitations": [
    "All product states are fictional premises. No product observations, benchmark runs, UI captures, or beneficiary evidence collected.",
    "Illustrative pass/fail states are PROPOSED; no qualification records exist. Operational acceptance remains blocked.",
    "The selected rows are a teaching slice, not comprehensive coverage of the candidate catalog."
  ],
  "registration_state": "NOT_REQUESTED"
}
